<?xml version="1.0" encoding="UTF-8"?>
<!--DTD generated by XMLSpy v2005 rel. 3 U (http://www.altova.com)-->
<!ELEMENT auteur (#PCDATA)>
<!ELEMENT bibliotheque (livre+)>
<!ELEMENT date_sortie (#PCDATA)>
<!ELEMENT livre (auteur, date_sortie, nbre_page)>
<!ELEMENT nbre_page (#PCDATA)>
